{
  "schema_version": "2.0",
  "scope": "Rockwool product families",
  "rating_scale": "1 = low relevance, 3 = useful, 5 = primary strength; ratings guide discovery and are not compliance or performance certificates",
  "families": [
    {
      "family_id": "ROCKWOOL_REFLECTIVE",
      "manufacturer": "Rockwool",
      "name": "Rockwool Reflective",
      "category": "Reflective",
      "primary_function": "Reflective insulation product from Rockwool.",
      "applications": [
        "Pipe"
      ],
      "keywords": [
        "reflective",
        "rockwool"
      ],
      "scores": {
        "acoustic_comfort": 2,
        "energy_efficiency": 5,
        "sustainability": 2,
        "installation_practicality": 4,
        "compliance_readiness": 3
      },
      "score_notes": "Deep-dive scoring for Rockwool Reflective: 71 SKUs generated from master catalogue spec data via scripts/generate_deep_dive_docs.py. Human QA against current manufacturer TDS/SDS still pending. Re-scored 2026-09-05 by scripts/rescore_family_scores.py using classification signals (manufacturer name/applications) instead of physical form alone.",
      "confidence": "manufacturer_supported",
      "knowledge_file": "reflective.md",
      "detailed_knowledge_status": "complete_deep_dive_2026-09-05",
      "source_url": "https://www.rockwool.com/syssiteassets/rw-sa/technical-resources/thermalrock-s---technical-datasheet-au---2023.pdf",
      "questions": [
        "What is the primary application for this product?",
        "What performance requirements apply?",
        "What space or area constraints exist?"
      ],
      "human_gates": [
        "Verify manufacturer identity from primary source",
        "Confirm product specifications and performance claims",
        "Validate compliance with relevant standards"
      ],
      "product_count": 71,
      "source_url_status": null,
      "legacy_source_url": null,
      "datasheet_url": null
    }
  ]
}
