{
  "schema_version": "2.0",
  "scope": "James Hardie product families",
  "rating_scale": "1 = low relevance, 3 = useful, 5 = primary strength; ratings guide discovery and are not compliance or performance certificates",
  "families": [
    {
      "family_id": "JAMES_HARDIE_FIRE_ROCKWOOL",
      "manufacturer": "James Hardie",
      "name": "JAMES HARDIEFIRE ROCKWOOl",
      "category": "Batt",
      "primary_function": "Batt insulation product from James Hardie.",
      "applications": [
        "Party Wall Fire"
      ],
      "keywords": [
        "batt",
        "james hardie",
        "james hardiefire rockwool"
      ],
      "scores": {
        "acoustic_comfort": 2,
        "energy_efficiency": 2,
        "sustainability": 4,
        "installation_practicality": 4,
        "compliance_readiness": 5
      },
      "score_notes": "Deep-dive scoring for JAMES HARDIEFIRE ROCKWOOl: 5 SKUs generated from master catalogue spec data via scripts/generate_deep_dive_docs.py. Human QA against current manufacturer TDS/SDS still pending. Re-scored 2026-09-05 by scripts/rescore_family_scores.py using classification signals (manufacturer name/applications) instead of physical form alone.",
      "confidence": "manufacturer_supported",
      "knowledge_file": "fire_rockwool.md",
      "detailed_knowledge_status": "complete_deep_dive_2026-09-05",
      "source_url": "https://www.jameshardie.com.au/ContentfulCMS/Installation-Guide/Hardie_Wrap_Weather_Barrier_Installation_Guide.pdf",
      "questions": [
        "What is the primary application for this product?",
        "What performance requirements apply?",
        "What space or area constraints exist?"
      ],
      "human_gates": [
        "Verify manufacturer identity from primary source",
        "Confirm product specifications and performance claims",
        "Validate compliance with relevant standards"
      ],
      "product_count": 5,
      "source_url_status": null,
      "legacy_source_url": null,
      "datasheet_url": null
    }
  ]
}
