{
  "schema_version": "2.0",
  "scope": "DCTech product families",
  "rating_scale": "1 = low relevance, 3 = useful, 5 = primary strength; ratings guide discovery and are not compliance or performance certificates",
  "families": [
    {
      "family_id": "DCTECH_ACOUSTIC_BARRIER",
      "manufacturer": "DCTech",
      "name": "DCTech Acoustic Barrier",
      "category": "Acoustic Barrier",
      "primary_function": "Acoustic Barrier insulation product from DCTech.",
      "applications": [
        "Internal Wall | Ceiling | Floor | General Acoustic"
      ],
      "keywords": [
        "acoustic barrier",
        "dctech"
      ],
      "scores": {
        "acoustic_comfort": 5,
        "energy_efficiency": 2,
        "sustainability": 3,
        "installation_practicality": 3,
        "compliance_readiness": 3
      },
      "score_notes": "Deep-dive scoring for DCTech Acoustic Barrier: 4 SKUs generated from master catalogue spec data via scripts/generate_deep_dive_docs.py. Human QA against current manufacturer TDS/SDS still pending. Re-scored 2026-09-05 by scripts/rescore_family_scores.py using classification signals (manufacturer name/applications) instead of physical form alone.",
      "confidence": "manufacturer_supported",
      "knowledge_file": "acoustic_barrier.md",
      "detailed_knowledge_status": "complete_deep_dive_2026-09-05",
      "source_url": "https://dctech.com.au/wp-content/uploads/2018/09/DCT_Industrial_Insulation_Brochure.pdf",
      "questions": [
        "What is the primary application for this product?",
        "What performance requirements apply?",
        "What space or area constraints exist?"
      ],
      "human_gates": [
        "Verify manufacturer identity from primary source",
        "Confirm product specifications and performance claims",
        "Validate compliance with relevant standards"
      ],
      "product_count": 4
    },
    {
      "family_id": "DCTECH_DCT_XPS_GA",
      "manufacturer": "DCTech",
      "name": "DCTech Dct Xps Ga",
      "category": "Board",
      "primary_function": "Board insulation product from DCTech.",
      "applications": [
        "Underfloor"
      ],
      "keywords": [
        "board",
        "dct xps ga",
        "dctech"
      ],
      "scores": {
        "acoustic_comfort": 2,
        "energy_efficiency": 5,
        "sustainability": 3,
        "installation_practicality": 3,
        "compliance_readiness": 4
      },
      "score_notes": "Deep-dive scoring for DCTech Dct Xps Ga: 6 SKUs generated from master catalogue spec data via scripts/generate_deep_dive_docs.py. Human QA against current manufacturer TDS/SDS still pending. Re-scored 2026-09-05 by scripts/rescore_family_scores.py using classification signals (manufacturer name/applications) instead of physical form alone.",
      "confidence": "manufacturer_supported",
      "knowledge_file": "dct_xps_ga.md",
      "detailed_knowledge_status": "complete_deep_dive_2026-09-05",
      "source_url": "https://dctech.com.au/wp-content/uploads/2018/09/DCT_Industrial_Insulation_Brochure.pdf",
      "questions": [
        "What is the primary application for this product?",
        "What performance requirements apply?",
        "What space or area constraints exist?"
      ],
      "human_gates": [
        "Verify manufacturer identity from primary source",
        "Confirm product specifications and performance claims",
        "Validate compliance with relevant standards"
      ],
      "product_count": 6
    },
    {
      "family_id": "DCTECH_TECSOUND",
      "manufacturer": "DCTech",
      "name": "DCTech Tecsound",
      "category": "Acoustic Barrier",
      "primary_function": "Acoustic Barrier insulation product from DCTech.",
      "applications": [
        "Internal Wall | Ceiling | Floor | General Acoustic"
      ],
      "keywords": [
        "acoustic barrier",
        "dctech",
        "tecsound"
      ],
      "scores": {
        "acoustic_comfort": 5,
        "energy_efficiency": 2,
        "sustainability": 3,
        "installation_practicality": 3,
        "compliance_readiness": 3
      },
      "score_notes": "Deep-dive scoring for DCTech Tecsound: 4 SKUs generated from master catalogue spec data via scripts/generate_deep_dive_docs.py. Human QA against current manufacturer TDS/SDS still pending. Re-scored 2026-09-05 by scripts/rescore_family_scores.py using classification signals (manufacturer name/applications) instead of physical form alone.",
      "confidence": "manufacturer_supported",
      "knowledge_file": "tecsound.md",
      "detailed_knowledge_status": "complete_deep_dive_2026-09-05",
      "source_url": "https://dctech.com.au/wp-content/uploads/2018/09/DCT_Industrial_Insulation_Brochure.pdf",
      "questions": [
        "What is the primary application for this product?",
        "What performance requirements apply?",
        "What space or area constraints exist?"
      ],
      "human_gates": [
        "Verify manufacturer identity from primary source",
        "Confirm product specifications and performance claims",
        "Validate compliance with relevant standards"
      ],
      "product_count": 4
    }
  ]
}
