{
  "schema_version": "2.0",
  "scope": "Knauf product families",
  "rating_scale": "1 = low relevance, 3 = useful, 5 = primary strength; ratings guide discovery and are not compliance or performance certificates",
  "families": [
    {
      "family_id": "KNAUF_BATT",
      "manufacturer": "Knauf",
      "name": "Knauf Batt",
      "category": "Batt",
      "primary_function": "Batt insulation product from Knauf.",
      "applications": [
        "Internal Wall | External Wall",
        "Ceiling",
        "Internal Wall | Ceiling | General Acoustic"
      ],
      "keywords": [
        "batt",
        "knauf"
      ],
      "scores": {
        "acoustic_comfort": 4,
        "energy_efficiency": 4,
        "sustainability": 4,
        "installation_practicality": 4,
        "compliance_readiness": 4
      },
      "score_notes": "Deep-dive scoring for Knauf Batt: 47 SKUs generated from master catalogue spec data via scripts/generate_deep_dive_docs.py. Human QA against current manufacturer TDS/SDS still pending. Re-scored 2026-09-05 by scripts/rescore_family_scores.py using classification signals (manufacturer name/applications) instead of physical form alone.",
      "confidence": "manufacturer_supported",
      "knowledge_file": "batt.md",
      "detailed_knowledge_status": "complete_deep_dive_2026-09-05",
      "source_url": "https://www.earthwool.com.au/wp-content/uploads/2024/11/datasheet_earthwool_wall_batt.pdf",
      "questions": [
        "What is the primary application for this product?",
        "What performance requirements apply?",
        "What space or area constraints exist?"
      ],
      "human_gates": [
        "Verify manufacturer identity from primary source",
        "Confirm product specifications and performance claims",
        "Validate compliance with relevant standards"
      ],
      "product_count": 47,
      "source_url_status": null,
      "legacy_source_url": null,
      "datasheet_url": null
    },
    {
      "family_id": "KNAUF_BLANKET_ROOF_LAMIN",
      "manufacturer": "Knauf",
      "name": "Knauf Blanket Roof Lamin",
      "category": "Batt",
      "primary_function": "Batt insulation product from Knauf.",
      "applications": [
        "Metal Roof / Shed"
      ],
      "keywords": [
        "batt",
        "blanket roof lamin",
        "knauf"
      ],
      "scores": {
        "acoustic_comfort": 2,
        "energy_efficiency": 5,
        "sustainability": 4,
        "installation_practicality": 4,
        "compliance_readiness": 4
      },
      "score_notes": "Deep-dive scoring for Knauf Blanket Roof Lamin: 6 SKUs generated from master catalogue spec data via scripts/generate_deep_dive_docs.py. Human QA against current manufacturer TDS/SDS still pending. Re-scored 2026-09-05 by scripts/rescore_family_scores.py using classification signals (manufacturer name/applications) instead of physical form alone.",
      "confidence": "manufacturer_supported",
      "knowledge_file": "blanket_roof_lamin.md",
      "detailed_knowledge_status": "complete_deep_dive_2026-09-05",
      "source_url": "https://www.earthwool.com.au/wp-content/uploads/2024/11/datasheet_earthwool_wall_batt.pdf",
      "questions": [
        "What is the primary application for this product?",
        "What performance requirements apply?",
        "What space or area constraints exist?"
      ],
      "human_gates": [
        "Verify manufacturer identity from primary source",
        "Confirm product specifications and performance claims",
        "Validate compliance with relevant standards"
      ],
      "product_count": 6,
      "source_url_status": null,
      "legacy_source_url": null,
      "datasheet_url": null
    }
  ]
}
