{
  "schema_version": "2.0",
  "scope": "Hushtec product families",
  "rating_scale": "1 = low relevance, 3 = useful, 5 = primary strength; ratings guide discovery and are not compliance or performance certificates",
  "families": [
    {
      "family_id": "HUSHTEC_ACOUSTIC_BARRIER",
      "manufacturer": "Hushtec",
      "name": "Hushtec Acoustic Barrier",
      "category": "Acoustic Barrier",
      "primary_function": "Acoustic Barrier insulation product from Hushtec.",
      "applications": [
        "Internal Wall | Ceiling | Floor | General Acoustic"
      ],
      "keywords": [
        "acoustic barrier",
        "hushtec"
      ],
      "scores": {
        "acoustic_comfort": 5,
        "energy_efficiency": 2,
        "sustainability": 3,
        "installation_practicality": 3,
        "compliance_readiness": 3
      },
      "score_notes": "Deep-dive scoring for Hushtec Acoustic Barrier: 2 SKUs generated from master catalogue spec data via scripts/generate_deep_dive_docs.py. Human QA against current manufacturer TDS/SDS still pending. Re-scored 2026-09-05 by scripts/rescore_family_scores.py using classification signals (manufacturer name/applications) instead of physical form alone.",
      "confidence": "manufacturer_supported",
      "knowledge_file": "acoustic_barrier.md",
      "detailed_knowledge_status": "complete_deep_dive_2026-09-05",
      "source_url": "https://masonmercer.com.au/wp-content/uploads/2024/06/Hushtec-Premium-Noise-Control-Brochure-Data-Sheet.pdf",
      "questions": [
        "What is the primary application for this product?",
        "What performance requirements apply?",
        "What space or area constraints exist?"
      ],
      "human_gates": [
        "Verify manufacturer identity from primary source",
        "Confirm product specifications and performance claims",
        "Validate compliance with relevant standards"
      ],
      "product_count": 2,
      "source_url_status": null,
      "legacy_source_url": null,
      "datasheet_url": null
    },
    {
      "family_id": "HUSHTEC_BATT",
      "manufacturer": "Hushtec",
      "name": "Hushtec Batt",
      "category": "Batt",
      "primary_function": "Batt insulation product from Hushtec.",
      "applications": [
        "Internal Wall | Ceiling | Floor | General Acoustic"
      ],
      "keywords": [
        "batt",
        "hushtec"
      ],
      "scores": {
        "acoustic_comfort": 5,
        "energy_efficiency": 2,
        "sustainability": 4,
        "installation_practicality": 4,
        "compliance_readiness": 4
      },
      "score_notes": "Deep-dive scoring for Hushtec Batt: 2 SKUs generated from master catalogue spec data via scripts/generate_deep_dive_docs.py. Human QA against current manufacturer TDS/SDS still pending. Re-scored 2026-09-05 by scripts/rescore_family_scores.py using classification signals (manufacturer name/applications) instead of physical form alone.",
      "confidence": "manufacturer_supported",
      "knowledge_file": "batt.md",
      "detailed_knowledge_status": "complete_deep_dive_2026-09-05",
      "source_url": "https://masonmercer.com.au/wp-content/uploads/2024/06/Hushtec-Premium-Noise-Control-Brochure-Data-Sheet.pdf",
      "questions": [
        "What is the primary application for this product?",
        "What performance requirements apply?",
        "What space or area constraints exist?"
      ],
      "human_gates": [
        "Verify manufacturer identity from primary source",
        "Confirm product specifications and performance claims",
        "Validate compliance with relevant standards"
      ],
      "product_count": 2,
      "source_url_status": null,
      "legacy_source_url": null,
      "datasheet_url": null
    },
    {
      "family_id": "HUSHTEC_REFLECTIVE",
      "manufacturer": "Hushtec",
      "name": "Hushtec Reflective",
      "category": "Reflective",
      "primary_function": "Reflective insulation product from Hushtec.",
      "applications": [
        "Metal Roof / Shed | External Wall"
      ],
      "keywords": [
        "hushtec",
        "reflective"
      ],
      "scores": {
        "acoustic_comfort": 2,
        "energy_efficiency": 5,
        "sustainability": 2,
        "installation_practicality": 4,
        "compliance_readiness": 3
      },
      "score_notes": "Deep-dive scoring for Hushtec Reflective: 1 SKUs generated from master catalogue spec data via scripts/generate_deep_dive_docs.py. Human QA against current manufacturer TDS/SDS still pending. Re-scored 2026-09-05 by scripts/rescore_family_scores.py using classification signals (manufacturer name/applications) instead of physical form alone.",
      "confidence": "manufacturer_supported",
      "knowledge_file": "reflective.md",
      "detailed_knowledge_status": "complete_deep_dive_2026-09-05",
      "source_url": "https://masonmercer.com.au/wp-content/uploads/2024/06/Hushtec-Premium-Noise-Control-Brochure-Data-Sheet.pdf",
      "questions": [
        "What is the primary application for this product?",
        "What performance requirements apply?",
        "What space or area constraints exist?"
      ],
      "human_gates": [
        "Verify manufacturer identity from primary source",
        "Confirm product specifications and performance claims",
        "Validate compliance with relevant standards"
      ],
      "product_count": 1,
      "source_url_status": null,
      "legacy_source_url": null,
      "datasheet_url": null
    }
  ]
}
